{
  "spec_version": "1.9.0",
  "project": "sin-e-phile",
  "last_updated": "2026-10-25",
  "sessions_completed": 19,
  "current_phase": {
    "number": 4,
    "slug": "metadata-backbone",
    "title": "Metadata Backbone",
    "branch": "phase/04-metadata-backbone",
    "started_at": "2026-08-31T18:43:02Z",
    "status": "in_progress",
    "note": "The catalogue. Three constraints carry in: ADR-0013 and ADR-0027 mean the app must be complete and good-looking with NO TMDB key and no key ever ships; ADR-0026 means SQL is runtime-checked, so every new repository method needs a line in crates/persistence/tests/repository_surface.rs; and R4 (ingestion larger or slower than expected) is this phase's named risk — measure before committing to a shape, and scope by a popularity threshold rather than ingesting everything.",
    "subtasks": [
      {
        "id": "4.1",
        "text": "tools/ingest skeleton: resumable job runner with checkpointing and progress reporting, so a killed run resumes rather than restarts",
        "status": "complete",
        "commit": "4a78d64"
      },
      {
        "id": "4.2",
        "text": "IMDb dataset download, verification and normalisation into media_items, titles, people, credits, genres",
        "status": "complete",
        "commit": "048180a"
      },
      {
        "id": "4.3",
        "text": "MovieLens join for ratings and popularity (ADR-0019, on-device)",
        "status": "complete",
        "commit": "42177d6"
      },
      {
        "id": "4.4",
        "text": "AniList ingestion: anime catalogue, romaji/native/english titles, and seasonal episode numbering into episode_numbering. Absolute numbering is NULL by ADR-0031 - no free source publishes one.",
        "status": "complete",
        "commit": "a170532"
      },
      {
        "id": "4.5",
        "text": "External-ID cross-mapping TMDB/IMDb/AniList/MAL with documented conflict-resolution rules",
        "status": "complete",
        "commit": "f67d939"
      },
      {
        "id": "4.6",
        "text": "Live API clients (TMDB, AniList, Jikan, Fanart.tv): shared rate limiter, exponential backoff, persistent response cache with per-resource TTLs, graceful offline",
        "status": "complete",
        "commit": "38d75d7"
      },
      {
        "id": "4.7",
        "text": "Per-profile TMDB key from settings, never shipped (ADR-0027), DPAPI-wrapped at rest; every TMDB-dependent surface degrades to the typographic state. Storage and the degradation contract are done; the settings UI is Phase 14.",
        "status": "in_progress",
        "commit": null
      },
      {
        "id": "4.8",
        "text": "Image handling: lazy fetch, disk cache with a size budget, WebP re-encoding (42.1% measured on real stills), blurhash placeholders. crates/artwork is done; wiring it to a TMDB image client is Phase 11.",
        "status": "in_progress",
        "commit": null
      },
      {
        "id": "4.9",
        "text": "First-run flow: usable during the background build, searching what is ingested so far. CatalogueRepository::readiness is the backend surface (Empty/Building/Interrupted/Ready, each carrying the searchable count); the progress UI itself is Phase 14.",
        "status": "in_progress",
        "commit": null
      },
      {
        "id": "4.10",
        "text": "The embedding artefact producer (ADR-0014). crates/embedding holds the document builder, int8 quantisation and the checksummed format; tools/ingest/src/embed.rs is the resumable producer, model and tokenizer checksum-pinned; format specified in docs/specs/embedding-artefact.md. PRODUCED: 855,703 vectors, 313 MB, sha256 3fce6f06..., verified by `ingest verify-embeddings`. Publishing it is blocker B3.",
        "status": "complete",
        "commit": "4f302d5"
      },
      {
        "id": "4.11",
        "text": "50-title anime fixture for E5: fixtures/anime/e5-hand-checked.tsv, 64 rows, checked by `ingest verify-anime` which exits non-zero on any mismatch",
        "status": "complete",
        "commit": "f19ddda"
      },
      {
        "id": "4.12",
        "text": "Rate-limit stress test: 1,000 rapid lookups never exceed the documented limits",
        "status": "complete",
        "commit": "38d75d7"
      },
      {
        "id": "4.13",
        "text": "Incremental catalogue refresh (ADR-0030): re-fetch title.basics/ratings/episode and insert only the tail past the highest id already stored, reusing TsvReader::seek_past. Plus AniList airing schedules, which need no key. See docs/specs/catalogue-freshness.md.",
        "status": "complete",
        "commit": "47e7353"
      }
    ],
    "exit_criteria": [
      {
        "id": "E1",
        "text": "Full ingestion completes on the dev machine and the resulting database is under a documented size budget.",
        "met": true,
        "evidence": "`./target/release/ingest movielens` completed 2026-09-07, closing the last loader. Full ingestion now complete across every job: title.basics 2,701,195, title.principals 10,092,368, name.basics 2,736,235, title.akas 5,908,381, episodes 132,845 rows / 5,862 seasons / 4,529 series, MovieLens 61,912 of 62,423 films matched (99.2%) over 25,000,095 ratings streamed. RESULTING DATABASE 3,659 MB (3,836,723,200 bytes, `ls -la data/sinephile.db`), against the 4 GB budget documented in docs/RISKS.md R4 - 341 MB of headroom. The 313 MB artefact and 435 MB index live OUTSIDE the database and are counted separately (D33)."
      },
      {
        "id": "E2",
        "text": "Ingestion killed mid-run resumes correctly.",
        "met": true,
        "evidence": "`cargo test -p sinephile-ingest --test resume` -> 10 passing, 2026-09-05. a_killed_run_resumes_and_repeats_nothing asserts 50 items exist EXACTLY once after a kill at item 20; progress_survives_a_restart; a_step_that_does_not_advance_its_cursor_is_stopped; and an_interrupted_run_resumes_at_the_next_page in tests/anime.rs. Demonstrated for real as well: the AniList sweep was interrupted and resumed during development, and a_crash_mid_step_reports_that_it_is_resuming was corrected after `is_resuming` was found reporting a fresh run on every real resume."
      },
      {
        "id": "E3",
        "text": "Catalogue lookups work with the network disconnected.",
        "met": true,
        "evidence": "STRUCTURAL: crates/persistence has no HTTP client in its dependency tree - sqlx is configured sqlite-only with no postgres/mysql feature, and the rest is serde, thiserror, time, tracing, windows-sys. The catalogue layer is incapable of a network call, so lookups cannot depend on one. Exercised by 72 passing tests in `cargo test -p sinephile-persistence`, including the 500,000-row indexed-lookup benchmark, none of which touch a network."
      },
      {
        "id": "E4",
        "text": "Rate limits are never exceeded under a stress test of 1,000 rapid lookups.",
        "met": true,
        "evidence": "`cargo test -p sinephile-metadata-api` -> limiter::tests::a_thousand_rapid_requests_never_exceed_the_limit, 2026-09-05. 1,000 acquisitions against a 40-per-10-seconds limit must take at least (1000-40)/4 = 240 simulated seconds; the test fails if they are faster. Uses tokio's paused clock, so it measures the limiter rather than the wall."
      },
      {
        "id": "E5",
        "text": "Anime titles resolve across AniList and TMDB with correct ID mapping for a hand-checked set of 50 titles including tricky cases (long-running shonen, split-cour seasons, films tied to series).",
        "met": true,
        "evidence": "`./target/release/ingest verify-anime` -> 64/64 pass, 2026-09-04. Fixture fixtures/anime/e5-hand-checked.tsv covers long-running shonen, split-cour seasons and films tied to series, plus 3 expected REFUSALS and 2 season claims. Numbers and the four fixture errors the first run exposed are in docs/eval-results.md. TMDB half of E5 is not covered - no key ships (ADR-0027), so it is verified per-user in subtask 4.7."
      },
      {
        "id": "E6",
        "text": "The catalogue is fully usable with no TMDB key (ADR-0013): titles, years, runtimes, genres, cast, crew and ratings all present from IMDb + MovieLens alone. TMDB enrichment adds artwork and rich detail and is verified to be additive, never load-bearing.",
        "met": true,
        "evidence": "MEASURED on the real catalogue, 2026-09-05, with NO TMDB key ever supplied: 0 rows in external_ids with source='tmdb' and 0 TMDB responses in http_cache. The catalogue nonetheless holds 2,702,737 titles, 855,703 core-tier, 10,079,841 credits, 6,176,950 title rows, 4,450,735 genre links, 1,086,210 ratings, 2,008,183 runtimes and 539,817 episodes - all from IMDb and AniList alone. ADR-0027's per-profile key surface exists (crates/persistence/src/repositories/credentials.rs) and defaults to TmdbAccess::Absent."
      },
      {
        "id": "E7",
        "text": "The embedding artefact is produced and published (ADR-0014) by a reproducible script in `tools/ingest/`, run on the author's machine. It is deterministic, checksummed, resumable, and records model identity, quantisation, embedding dimension, document-builder version and catalogue snapshot date. The application refuses to load an artefact whose model identity does not match its own, and degrades to FTS5-only search when the artefact is absent.",
        "met": true,